{
  "name": "deepseek-v2-lite-4a4f-graph-multinode",
  "model": {
    "family": "deepseek_v2_lite",
    "model_id": "deepseek-ai/DeepSeek-V2-Lite",
    "trust_remote_code": true,
    "extra_serve_args": {}
  },
  "topology": {
    "strategy": "colocation",
    "afd_enabled": true,
    "num_attention_ranks": 4,
    "num_ffn_ranks": 4,
    "attention": {"data_parallel_size": 2, "tensor_parallel_size": 2},
    "ffn": {"data_parallel_size": 2, "tensor_parallel_size": 2}
  },
  "placement": {"node_mode": "multi"},
  "execution": {"mode": "graph", "cudagraph_capture_size": 64},
  "dbo": {"enabled": true, "decode_token_threshold": 2, "prefill_token_threshold": 12},
  "serving": {
    "max_num_seqs": 64,
    "max_num_batched_tokens": 64,
    "max_model_len": 8192,
    "enable_expert_parallel": true
  }
}
